{
  "$schema": "http://json-schema.org/draft-07/schema#",
  "type": ["object", "null"],
  "title": "RAM Schema",
  "description": "Schema for RAM components",
  "required": ["metadata"],
  "properties": {
    "opendb_id": {
      "type": ["string", "null"],
      "description": "Unique identifier for the document (UUID v4)"
    },
    "weight": {
      "description": "Product weight in grams for one complete, usable unit of this exact variant. Exclude retail packaging, shipping materials, multipack totals, and load capacity. Leave unset when the product is digital, the weight is unknown, or the source does not clearly identify product weight.",
      "type": ["number", "null"],
      "exclusiveMinimum": 0
    },
    "speed": {
      "description": "The speed of the RAM in MHz (e.g., 6000, 3200). Looks for hints of this in the product name.",
      "type": ["number", "null"]
    },
    "ram_type": {
      "description": "DDR generation (e.g., DDR4, DDR5)",
      "type": ["string", "null"],
      "enum": ["DDR5", "DDR4", "DDR3", "DDR2", "DDR1", null]
    },
    "profile_support": {
      "description": "Overclocking profile support tags (xmp_only, expo_only)",
      "type": ["array", "null"],
      "items": {
        "type": "string",
        "enum": ["XMP", "EXPO"]
      }
    },
    "form_factor": {
      "description": "The physical form factor of the RAM module (e.g., 288-pin DIMM, 260-pin SO-DIMM)",
      "type": ["string", "null"],
      "enum": [
        "288-pin DIMM",
        "262-pin SO-DIMM",
        "260-pin SO-DIMM",
        "240-pin DIMM",
        "204-pin SO-DIMM",
        "200-pin SO-DIMM",
        "184-pin DIMM",
        "UDIMM",
        "DIMM",
        null
      ]
    },
    "modules": {
      "type": ["object", "null"],
      "properties": {
        "quantity": {
          "description": "Number of modules in the kit. Looks for hints of this in the product name.",
          "type": ["number", "null"]
        },
        "capacity_gb": {
          "description": "Capacity per module in GB. Looks for hints of this in the product name.",
          "type": ["number", "null"]
        }
      }
    },
    "capacity": {
      "description": "Total capacity of the RAM kit in GB. Looks for hints of this in the product name.",
      "type": ["number", "null"]
    },
    "color": {
      "description": "The color(s) of this product. Each color of the product should be included in the array. Do not use RGB here to describe lighting; use the Lighting field for RGB, ARGB, display, or fixed-color lighting. Includes PCB and heat spreader colors. Looks for hints of this in the product name.",
      "type": ["array", "null"],
      "items": {
        "type": "string",
        "enum": [
          "BLACK",
          "WHITE",
          "RGB",
          "RED",
          "BLUE",
          "GREEN",
          "GREY",
          "YELLOW",
          "ORANGE",
          "PURPLE",
          "PINK",
          "BROWN",
          "GOLD"
        ]
      }
    },
    "lighting": {
      "description": "Lighting capabilities for this product. Use RGB for non-addressable RGB, ARGB for addressable RGB, Multicolor for non-RGB multi-color lighting, Fixed for a single fixed lighting color, None when the product has no lighting, Display for configurable displays, and Fixed Color Display for displays limited to fixed colors such as black and white.",
      "type": ["array", "null"],
      "items": {
        "type": "string",
        "enum": ["RGB", "ARGB", "Multicolor", "Fixed", "None", "Display", "Fixed Color Display"]
      }
    },
    "cas_latency": {
      "description": "The CAS latency of the RAM. Looks for hints of this in the product name.",
      "type": ["number", "null"]
    },
    "timings": {
      "description": "The complete timing specification of the RAM (e.g., 30-36-36-76). Looks for hints of this in the product name.",
      "type": ["string", "null"]
    },
    "voltage": {
      "description": "The operating voltage of the RAM",
      "type": ["number", "null"]
    },
    "ecc": {
      "description": "Whether the RAM supports Error-Correcting Code (e.g., Non-ECC, ECC)",
      "type": ["string", "null"],
      "enum": ["ECC", "Non-ECC", null]
    },
    "registered": {
      "description": "Whether the RAM is registered or unbuffered (e.g., Unbuffered, Registered, Load Reduced)",
      "type": ["string", "null"],
      "enum": ["Unbuffered", "Registered", "Load Reduced", null]
    },
    "heat_spreader": {
      "description": "Whether the RAM modules have a heat spreader",
      "type": ["boolean", "null"]
    },
    "rgb": {
      "description": "Whether the RAM has RGB lighting",
      "type": ["boolean", "null"]
    },
    "height": {
      "description": "The height of the RAM module in mm",
      "type": ["number", "null"]
    },
    "general_product_information": {
      "type": ["object", "null"],
      "description": "General product information and retailer SKUs",
      "properties": {
        "amazon_sku": {
          "type": ["string", "null"],
          "description": "Amazon product SKU"
        },
        "newegg_sku": {
          "type": ["string", "null"],
          "description": "Newegg product SKU"
        },
        "bestbuy_sku": {
          "type": ["number", "null"],
          "description": "Best Buy product SKU"
        },
        "walmart_sku": {
          "type": ["number", "null"],
          "description": "Walmart product SKU"
        },
        "adorama_sku": {
          "type": ["string", "null"],
          "description": "Adorama product SKU"
        },
        "ibuypower_sku": {
          "type": ["string", "null"],
          "description": "iBuyPower product SKU"
        },
        "hyte_sku": {
          "type": ["string", "null"],
          "description": "HYTE product SKU"
        },
        "lttstore_sku": {
          "type": ["string", "null"],
          "description": "LTTStore product SKU"
        },
        "manufacturer_url": {
          "type": ["string", "null"],
          "description": "Official manufacturer product URL"
        }
      }
    },
    "metadata": {
      "type": ["object", "null"],
      "properties": {
        "name": {
          "description": "Full product name",
          "type": ["string", "null"]
        },
        "manufacturer": {
          "description": "RAM manufacturer Use the memory kit manufacturer. Examples: Corsair, G.Skill, Kingston.",
          "type": ["string", "null"]
        },
        "part_numbers": {
          "description": "Array of manufacturer's part numbers/SKUs",
          "type": ["array", "null"],
          "items": {
            "type": "string"
          }
        },
        "series": {
          "description": "Product series name The manufacturer's marketed product line / family for the kit. Manufacturer and `ram_type` are stored separately and used as the default grouping. Speed, CAS latency, capacity, and module count are ALSO stored separately and MUST NOT be in the series. Color goes in `manufacturer_color`. The series string MUST be identical across kits the manufacturer markets under the same product line, regardless of speed/capacity/timing/color. Examples: 'G.Skill Aegis Black / Red DDR4-3200 CL16 32GB' → series='Aegis'. 'G.Skill Trident Z5 Neo RGB DDR5-6000 CL30' → series='Trident Z5 Neo' (only include `RGB` in the series when it's part of a distinct product line like `Vengeance RGB Pro`). 'Corsair Vengeance LPX DDR4-3200' → series='Vengeance LPX'.",
          "type": ["string", "null"]
        },
        "variant": {
          "description": "Specific variant in the series Most RAM kits should have an empty variant — speed, CAS latency, timings, capacity, modules, and color are all stored in their own fields and are NOT variants. Only fill `variant` when the manufacturer ships a genuine sub-model within the same (manufacturer, series, ram_type) group (separately marketed revision, regional / OEM-only spin, distinct binning tier sold under the same series name). Examples: 'G.Skill Aegis DDR4-3200 CL16 32GB (Black / Red)' → variant=''. 'G.Skill Trident Z5 Neo RGB DDR5-6000 CL30' → variant='' (RGB is captured by the `rgb` flag and 'Neo' is part of the series). 'Corsair Vengeance LPX DDR4-3200' → variant=''. If you find yourself wanting to put speed, CAS, timings, capacity, kit count, or color into variant — stop and use the dedicated field instead. The variant must be unique within a (manufacturer, series, ram_type, manufacturer_color) group; if every kit collapses to the same value, leave it empty.",
          "type": ["string", "null"]
        },
        "releaseYear": {
          "description": "Year of release",
          "type": ["number", "null"]
        },
        "manufacturer_color": {
          "description": "Manufacturer's official color name for this product variant. The manufacturer's marketed colorway / heat-spreader finish name, verbatim. Common values: 'Black', 'White', 'Black / Red'. Multi-tone heat spreaders use ' / '. Branded special / collab colorways belong here when the rest of the SKU is identical (e.g., 'Royal Silver', 'Hatsune Miku Edition'). Most stock kits are 'Black'. Do NOT put speed, CL, capacity, RGB, or model-line names like 'Trident Z5', 'Aegis', 'Neo' in manufacturer_color — those belong in series / dedicated fields.",
          "type": ["string", "null"]
        },
        "last_manually_spec_verified_at": {
          "type": ["string", "null"],
          "format": "date-time",
          "description": "ISO 8601 timestamp of when the part specs were last manually verified by a human"
        }
      },
      "required": ["name"]
    },
    "identifiers": {
      "type": "object",
      "properties": {
        "version": {
          "type": "integer",
          "exclusiveMinimum": 0,
          "maximum": 9007199254740991,
          "description": "Monotonically increasing identity snapshot version"
        },
        "identifiers": {
          "type": "array",
          "items": {
            "type": "object",
            "properties": {
              "type": {
                "type": "string",
                "enum": ["upc", "ean", "gtin", "mpn"]
              },
              "value": {
                "type": "string",
                "minLength": 1
              },
              "region": {
                "default": "all",
                "type": "string",
                "minLength": 1
              }
            },
            "required": ["type", "value", "region"],
            "additionalProperties": false
          },
          "description": "Canonical product identifiers"
        },
        "retailer_listings": {
          "type": "array",
          "items": {
            "type": "object",
            "properties": {
              "source": {
                "type": "string",
                "minLength": 1
              },
              "channel": {
                "type": "string",
                "minLength": 1
              },
              "source_product_id": {
                "type": "string",
                "minLength": 1
              },
              "pricing_enabled": {
                "type": "boolean"
              },
              "excluded_source_offer_ids": {
                "type": "array",
                "items": {
                  "type": "string",
                  "minLength": 1,
                  "maxLength": 512
                }
              },
              "verified": {
                "type": "boolean"
              }
            },
            "required": ["source", "channel", "source_product_id", "pricing_enabled", "verified"],
            "additionalProperties": false
          },
          "description": "Canonical retailer product listings used for pricing"
        }
      },
      "required": ["version", "identifiers", "retailer_listings"],
      "additionalProperties": false,
      "description": "Current versioned product identity snapshot used for retailer and pricing matching"
    }
  }
}
