{
  "opendb_id": "3711a1dd-0032-457e-9b08-bf0d895cfe31",
  "speed": 6400,
  "ram_type": "DDR5",
  "profile_support": ["XMP", "EXPO"],
  "form_factor": "288-pin DIMM",
  "modules": {
    "quantity": 2,
    "capacity_gb": 16
  },
  "capacity": 32,
  "color": ["BLACK"],
  "lighting": [],
  "cas_latency": 32,
  "timings": "32-39-39-102",
  "voltage": 1.4,
  "ecc": "Non-ECC",
  "registered": "Unbuffered",
  "metadata": {
    "name": "Biwin Black Opal HX100 DDR5-6400 32GB (2x16GB) CL32 Black",
    "manufacturer": "Biwin",
    "part_numbers": ["B5HX100326432FR2G-BB002"],
    "series": "Black Opal HX100 DDR5"
  },
  "general_product_information": {},
  "identifiers": {
    "version": 1,
    "identifiers": [
      {
        "type": "mpn",
        "value": "B5HX100326432FR2G-BB002",
        "region": "all"
      }
    ],
    "retailer_listings": []
  }
}
