{
  "opendb_id": "220a5fa7-a83b-41cc-bcf3-414937b022a5",
  "speed": 6600,
  "ram_type": "DDR5",
  "profile_support": [],
  "form_factor": "288-pin DIMM",
  "modules": {
    "quantity": 2,
    "capacity_gb": 16
  },
  "capacity": 32,
  "color": ["WHITE"],
  "lighting": ["ARGB"],
  "cas_latency": 34,
  "timings": "34-40-40-84",
  "voltage": null,
  "ecc": "Non-ECC",
  "registered": "Unbuffered",
  "heat_spreader": true,
  "rgb": true,
  "metadata": {
    "name": "TEAMGROUP T-Force Delta RGB DDR5-6600 CL34 32GB (2x16GB)",
    "manufacturer": "TEAMGROUP",
    "part_numbers": ["FF4D532G6600HC34DC01"],
    "series": "T-Force Delta RGB",
    "variant": "6600 CL34",
    "manufacturer_color": "White"
  },
  "general_product_information": {},
  "identifiers": {
    "version": 1,
    "identifiers": [
      {
        "type": "ean",
        "value": "0765441661691",
        "region": "all"
      },
      {
        "type": "mpn",
        "value": "FF4D532G6600HC34DC01",
        "region": "all"
      },
      {
        "type": "upc",
        "value": "765441661691",
        "region": "all"
      }
    ],
    "retailer_listings": [
      {
        "source": "alternate",
        "channel": "de",
        "source_product_id": "1891959",
        "pricing_enabled": true,
        "verified": false
      },
      {
        "source": "alternate",
        "channel": "es",
        "source_product_id": "1891959",
        "pricing_enabled": true,
        "verified": false
      },
      {
        "source": "alternate",
        "channel": "fr",
        "source_product_id": "1891959",
        "pricing_enabled": true,
        "verified": false
      },
      {
        "source": "alternate",
        "channel": "it",
        "source_product_id": "1891959",
        "pricing_enabled": true,
        "verified": false
      },
      {
        "source": "amazon",
        "channel": "au",
        "source_product_id": "B0BR911184",
        "pricing_enabled": true,
        "verified": true
      },
      {
        "source": "amazon",
        "channel": "be",
        "source_product_id": "B0BR911184",
        "pricing_enabled": true,
        "verified": true
      },
      {
        "source": "amazon",
        "channel": "ca",
        "source_product_id": "B0BR911184",
        "pricing_enabled": true,
        "verified": true
      },
      {
        "source": "amazon",
        "channel": "de",
        "source_product_id": "B0BR911184",
        "pricing_enabled": true,
        "verified": true
      },
      {
        "source": "amazon",
        "channel": "es",
        "source_product_id": "B0BR911184",
        "pricing_enabled": true,
        "verified": true
      },
      {
        "source": "amazon",
        "channel": "fr",
        "source_product_id": "B0BR911184",
        "pricing_enabled": true,
        "verified": true
      },
      {
        "source": "amazon",
        "channel": "ie",
        "source_product_id": "B0BR911184",
        "pricing_enabled": true,
        "verified": true
      },
      {
        "source": "amazon",
        "channel": "it",
        "source_product_id": "B0BR911184",
        "pricing_enabled": true,
        "verified": true
      },
      {
        "source": "amazon",
        "channel": "jp",
        "source_product_id": "B0BR911184",
        "pricing_enabled": true,
        "verified": true
      },
      {
        "source": "amazon",
        "channel": "nl",
        "source_product_id": "B0BR911184",
        "pricing_enabled": true,
        "verified": true
      },
      {
        "source": "amazon",
        "channel": "pl",
        "source_product_id": "B0BR911184",
        "pricing_enabled": true,
        "verified": true
      },
      {
        "source": "amazon",
        "channel": "se",
        "source_product_id": "B0BR911184",
        "pricing_enabled": true,
        "verified": true
      },
      {
        "source": "amazon",
        "channel": "sg",
        "source_product_id": "B0BR911184",
        "pricing_enabled": true,
        "verified": true
      },
      {
        "source": "amazon",
        "channel": "uk",
        "source_product_id": "B0BR911184",
        "pricing_enabled": true,
        "verified": true
      },
      {
        "source": "amazon",
        "channel": "us",
        "source_product_id": "B0BR911184",
        "pricing_enabled": true,
        "verified": true
      },
      {
        "source": "caseking",
        "channel": "es",
        "source_product_id": "FF4D532G6600HC34DC",
        "pricing_enabled": true,
        "verified": false
      },
      {
        "source": "cenowarka",
        "channel": "pl",
        "source_product_id": "2829458",
        "pricing_enabled": true,
        "verified": false
      },
      {
        "source": "geizhals",
        "channel": "de",
        "source_product_id": "2829458",
        "pricing_enabled": true,
        "verified": false
      },
      {
        "source": "newegg",
        "channel": "ca",
        "source_product_id": "N82E16820331977",
        "pricing_enabled": true,
        "verified": false
      },
      {
        "source": "newegg",
        "channel": "us",
        "source_product_id": "N82E16820331977",
        "pricing_enabled": true,
        "verified": false
      },
      {
        "source": "skinflint",
        "channel": "uk",
        "source_product_id": "2829458",
        "pricing_enabled": true,
        "verified": false
      },
      {
        "source": "walmart",
        "channel": "us",
        "source_product_id": "3424330444",
        "pricing_enabled": true,
        "verified": false
      }
    ]
  }
}
