{
  "opendb_id": "597b0bed-83b2-41c9-b5e8-beb9a8c24002",
  "speed": 3600,
  "ram_type": "DDR4",
  "profile_support": [],
  "form_factor": "288-pin DIMM",
  "modules": {
    "quantity": 2,
    "capacity_gb": 8
  },
  "capacity": 16,
  "color": ["BLACK"],
  "lighting": ["ARGB"],
  "cas_latency": 18,
  "timings": "18-22-22-42",
  "voltage": null,
  "ecc": "Non-ECC",
  "registered": "Unbuffered",
  "heat_spreader": true,
  "rgb": true,
  "metadata": {
    "name": "Corsair Vengeance RGB Pro Black DDR4-3600 CL18 16GB (2x8GB)",
    "manufacturer": "Corsair",
    "part_numbers": ["CMW16GX4M2Z3600C18"],
    "series": "Vengeance RGB Pro",
    "variant": "Default",
    "manufacturer_color": "Black"
  },
  "general_product_information": {},
  "identifiers": {
    "version": 2,
    "identifiers": [
      {
        "type": "ean",
        "value": "0840006615682",
        "region": "all"
      },
      {
        "type": "mpn",
        "value": "CMW16GX4M2Z3600C18",
        "region": "all"
      },
      {
        "type": "upc",
        "value": "840006615682",
        "region": "all"
      }
    ],
    "retailer_listings": [
      {
        "source": "alternate",
        "channel": "de",
        "source_product_id": "1557104",
        "pricing_enabled": true,
        "verified": false
      },
      {
        "source": "alternate",
        "channel": "es",
        "source_product_id": "1557104",
        "pricing_enabled": true,
        "verified": false
      },
      {
        "source": "alternate",
        "channel": "fr",
        "source_product_id": "1557104",
        "pricing_enabled": true,
        "verified": false
      },
      {
        "source": "alternate",
        "channel": "it",
        "source_product_id": "1557104",
        "pricing_enabled": true,
        "verified": false
      },
      {
        "source": "amazon",
        "channel": "au",
        "source_product_id": "B07TC4TPCN",
        "pricing_enabled": true,
        "verified": true
      },
      {
        "source": "amazon",
        "channel": "be",
        "source_product_id": "B07TC4TPCN",
        "pricing_enabled": true,
        "verified": true
      },
      {
        "source": "amazon",
        "channel": "ca",
        "source_product_id": "B07TC4TPCN",
        "pricing_enabled": true,
        "verified": true
      },
      {
        "source": "amazon",
        "channel": "de",
        "source_product_id": "B07TC4TPCN",
        "pricing_enabled": true,
        "verified": true
      },
      {
        "source": "amazon",
        "channel": "es",
        "source_product_id": "B07TC4TPCN",
        "pricing_enabled": true,
        "verified": true
      },
      {
        "source": "amazon",
        "channel": "fr",
        "source_product_id": "B07TC4TPCN",
        "pricing_enabled": true,
        "verified": true
      },
      {
        "source": "amazon",
        "channel": "ie",
        "source_product_id": "B07TC4TPCN",
        "pricing_enabled": true,
        "verified": true
      },
      {
        "source": "amazon",
        "channel": "it",
        "source_product_id": "B07TC4TPCN",
        "pricing_enabled": true,
        "verified": true
      },
      {
        "source": "amazon",
        "channel": "jp",
        "source_product_id": "B07TC4TPCN",
        "pricing_enabled": true,
        "verified": true
      },
      {
        "source": "amazon",
        "channel": "nl",
        "source_product_id": "B07TC4TPCN",
        "pricing_enabled": true,
        "verified": true
      },
      {
        "source": "amazon",
        "channel": "pl",
        "source_product_id": "B07TC4TPCN",
        "pricing_enabled": true,
        "verified": true
      },
      {
        "source": "amazon",
        "channel": "se",
        "source_product_id": "B07TC4TPCN",
        "pricing_enabled": true,
        "verified": true
      },
      {
        "source": "amazon",
        "channel": "sg",
        "source_product_id": "B07TC4TPCN",
        "pricing_enabled": true,
        "verified": true
      },
      {
        "source": "amazon",
        "channel": "uk",
        "source_product_id": "B07TC4TPCN",
        "pricing_enabled": true,
        "verified": true
      },
      {
        "source": "amazon",
        "channel": "us",
        "source_product_id": "B07TC4TPCN",
        "pricing_enabled": true,
        "verified": true
      },
      {
        "source": "back-to-the-office",
        "channel": "uk",
        "source_product_id": "55306268246398",
        "pricing_enabled": true,
        "verified": false
      },
      {
        "source": "caseking",
        "channel": "es",
        "source_product_id": "CMW16GX4M2Z3600C18",
        "pricing_enabled": true,
        "verified": false
      },
      {
        "source": "cenowarka",
        "channel": "pl",
        "source_product_id": "2083934",
        "pricing_enabled": true,
        "verified": false
      },
      {
        "source": "corsair",
        "channel": "ca",
        "source_product_id": "CMW16GX4M2Z3600C18",
        "pricing_enabled": true,
        "verified": false
      },
      {
        "source": "corsair",
        "channel": "de",
        "source_product_id": "CMW16GX4M2Z3600C18",
        "pricing_enabled": true,
        "verified": false
      },
      {
        "source": "corsair",
        "channel": "es",
        "source_product_id": "CMW16GX4M2Z3600C18",
        "pricing_enabled": true,
        "verified": false
      },
      {
        "source": "corsair",
        "channel": "fr",
        "source_product_id": "CMW16GX4M2Z3600C18",
        "pricing_enabled": true,
        "verified": false
      },
      {
        "source": "corsair",
        "channel": "it",
        "source_product_id": "CMW16GX4M2Z3600C18",
        "pricing_enabled": true,
        "verified": false
      },
      {
        "source": "corsair",
        "channel": "uk",
        "source_product_id": "CMW16GX4M2Z3600C18",
        "pricing_enabled": true,
        "verified": false
      },
      {
        "source": "corsair",
        "channel": "us",
        "source_product_id": "CMW16GX4M2Z3600C18",
        "pricing_enabled": true,
        "verified": false
      },
      {
        "source": "geizhals",
        "channel": "de",
        "source_product_id": "2083934",
        "pricing_enabled": true,
        "verified": false
      },
      {
        "source": "jimms-pc",
        "channel": "fi",
        "source_product_id": "153130",
        "pricing_enabled": true,
        "verified": false
      },
      {
        "source": "newegg",
        "channel": "ca",
        "source_product_id": "9SIA8UCJYU7870",
        "pricing_enabled": true,
        "verified": false
      },
      {
        "source": "newegg",
        "channel": "us",
        "source_product_id": "9SIA8UCJYU7870",
        "pricing_enabled": true,
        "verified": false
      },
      {
        "source": "overclockers",
        "channel": "uk",
        "source_product_id": "MY-4C1-CS",
        "pricing_enabled": true,
        "verified": false
      },
      {
        "source": "proshop",
        "channel": "de",
        "source_product_id": "2787792",
        "pricing_enabled": true,
        "verified": false
      },
      {
        "source": "proshop",
        "channel": "fi",
        "source_product_id": "2787792",
        "pricing_enabled": true,
        "verified": false
      },
      {
        "source": "proshop",
        "channel": "nl",
        "source_product_id": "2787792",
        "pricing_enabled": true,
        "verified": false
      },
      {
        "source": "proshop",
        "channel": "pl",
        "source_product_id": "2787792",
        "pricing_enabled": true,
        "verified": false
      },
      {
        "source": "quzo",
        "channel": "uk",
        "source_product_id": "205908",
        "pricing_enabled": true,
        "verified": false
      },
      {
        "source": "skinflint",
        "channel": "uk",
        "source_product_id": "2083934",
        "pricing_enabled": true,
        "verified": false
      },
      {
        "source": "walmart",
        "channel": "us",
        "source_product_id": "481751337",
        "pricing_enabled": true,
        "verified": false
      }
    ]
  }
}
