{
  "opendb_id": "ad400ed2-c25f-474c-b2db-e0f3b0274fa2",
  "speed": 5200,
  "ram_type": "DDR5",
  "profile_support": ["XMP", "EXPO"],
  "form_factor": "288-pin DIMM",
  "modules": {
    "quantity": 2,
    "capacity_gb": 16
  },
  "capacity": 32,
  "color": ["BLACK"],
  "lighting": [],
  "cas_latency": 40,
  "timings": "40-40-40-83",
  "voltage": 1.1,
  "ecc": "Non-ECC",
  "registered": "Unbuffered",
  "metadata": {
    "name": "G.SKILL Aegis 5 DDR5-5200 32GB (2x16GB) CL40",
    "manufacturer": "G.SKILL",
    "part_numbers": ["F5-5200J4040A16GX2-IS"],
    "series": "Aegis 5"
  },
  "general_product_information": {},
  "identifiers": {
    "version": 1,
    "identifiers": [
      {
        "type": "mpn",
        "value": "F5-5200J4040A16GX2-IS",
        "region": "all"
      }
    ],
    "retailer_listings": []
  }
}
