{
  "opendb_id": "fd636fcb-9068-4af7-b0d8-042cd25f1251",
  "speed": 5600,
  "ram_type": "DDR5",
  "profile_support": ["XMP"],
  "form_factor": "288-pin DIMM",
  "modules": {
    "quantity": 2,
    "capacity_gb": 16
  },
  "capacity": 32,
  "color": ["BLACK"],
  "lighting": ["None"],
  "cas_latency": 40,
  "voltage": null,
  "ecc": "Non-ECC",
  "registered": "Unbuffered",
  "heat_spreader": true,
  "rgb": false,
  "metadata": {
    "name": "PNY XLR8 Gaming MAKO Black DDR5-5600 CL40 32GB (2x16GB)",
    "manufacturer": "PNY",
    "part_numbers": [],
    "series": "XLR8 MAKO",
    "manufacturer_color": "Black"
  },
  "general_product_information": {},
  "identifiers": {
    "version": 1,
    "identifiers": [
      {
        "type": "mpn",
        "value": "MD32GK2D5560040MXR",
        "region": "all"
      }
    ],
    "retailer_listings": []
  }
}
