{
  "opendb_id": "045d68a6-e791-4cab-b29f-4e8956c41758",
  "speed": 3600,
  "ram_type": "DDR4",
  "profile_support": [],
  "form_factor": "288-pin DIMM",
  "modules": {
    "quantity": 1,
    "capacity_gb": 8
  },
  "capacity": 8,
  "color": ["BLACK"],
  "lighting": [],
  "cas_latency": 20,
  "timings": "20-26-26-46",
  "voltage": null,
  "ecc": "Non-ECC",
  "registered": "Unbuffered",
  "heat_spreader": true,
  "rgb": true,
  "metadata": {
    "name": "Patriot Viper Steel RGB Black DDR4-3600 CL20 8GB (1x8GB)",
    "manufacturer": "Patriot",
    "part_numbers": ["PVSR48G360C0"],
    "series": "Viper",
    "variant": "3600 CL20"
  },
  "general_product_information": {},
  "identifiers": {
    "version": 1,
    "identifiers": [
      {
        "type": "ean",
        "value": "0814914027905",
        "region": "all"
      },
      {
        "type": "mpn",
        "value": "PVSR48G360C0",
        "region": "all"
      },
      {
        "type": "upc",
        "value": "814914027905",
        "region": "all"
      }
    ],
    "retailer_listings": [
      {
        "source": "amazon",
        "channel": "au",
        "source_product_id": "B08N686TJQ",
        "pricing_enabled": true,
        "verified": true
      },
      {
        "source": "amazon",
        "channel": "be",
        "source_product_id": "B08N686TJQ",
        "pricing_enabled": true,
        "verified": true
      },
      {
        "source": "amazon",
        "channel": "ca",
        "source_product_id": "B08N686TJQ",
        "pricing_enabled": true,
        "verified": true
      },
      {
        "source": "amazon",
        "channel": "de",
        "source_product_id": "B08N686TJQ",
        "pricing_enabled": true,
        "verified": true
      },
      {
        "source": "amazon",
        "channel": "es",
        "source_product_id": "B08N686TJQ",
        "pricing_enabled": true,
        "verified": true
      },
      {
        "source": "amazon",
        "channel": "fr",
        "source_product_id": "B08N686TJQ",
        "pricing_enabled": true,
        "verified": true
      },
      {
        "source": "amazon",
        "channel": "ie",
        "source_product_id": "B08N686TJQ",
        "pricing_enabled": true,
        "verified": true
      },
      {
        "source": "amazon",
        "channel": "it",
        "source_product_id": "B08N686TJQ",
        "pricing_enabled": true,
        "verified": true
      },
      {
        "source": "amazon",
        "channel": "jp",
        "source_product_id": "B08N686TJQ",
        "pricing_enabled": true,
        "verified": true
      },
      {
        "source": "amazon",
        "channel": "nl",
        "source_product_id": "B08N686TJQ",
        "pricing_enabled": true,
        "verified": true
      },
      {
        "source": "amazon",
        "channel": "pl",
        "source_product_id": "B08N686TJQ",
        "pricing_enabled": true,
        "verified": true
      },
      {
        "source": "amazon",
        "channel": "se",
        "source_product_id": "B08N686TJQ",
        "pricing_enabled": true,
        "verified": true
      },
      {
        "source": "amazon",
        "channel": "sg",
        "source_product_id": "B08N686TJQ",
        "pricing_enabled": true,
        "verified": true
      },
      {
        "source": "amazon",
        "channel": "uk",
        "source_product_id": "B08N686TJQ",
        "pricing_enabled": true,
        "verified": true
      },
      {
        "source": "amazon",
        "channel": "us",
        "source_product_id": "B08N686TJQ",
        "pricing_enabled": true,
        "verified": true
      },
      {
        "source": "cenowarka",
        "channel": "pl",
        "source_product_id": "2458099",
        "pricing_enabled": true,
        "verified": false
      },
      {
        "source": "geizhals",
        "channel": "de",
        "source_product_id": "2458099",
        "pricing_enabled": true,
        "verified": false
      },
      {
        "source": "proshop",
        "channel": "de",
        "source_product_id": "3197317",
        "pricing_enabled": true,
        "verified": false
      },
      {
        "source": "proshop",
        "channel": "fi",
        "source_product_id": "3197317",
        "pricing_enabled": true,
        "verified": false
      },
      {
        "source": "proshop",
        "channel": "nl",
        "source_product_id": "3197317",
        "pricing_enabled": true,
        "verified": false
      },
      {
        "source": "proshop",
        "channel": "pl",
        "source_product_id": "3197317",
        "pricing_enabled": true,
        "verified": false
      },
      {
        "source": "skinflint",
        "channel": "uk",
        "source_product_id": "2458099",
        "pricing_enabled": true,
        "verified": false
      },
      {
        "source": "walmart",
        "channel": "us",
        "source_product_id": "642031680",
        "pricing_enabled": true,
        "verified": false
      }
    ]
  }
}
