{
  "opendb_id": "3b574cb9-8944-431b-a965-3f11cfcc6d29",
  "speed": 3200,
  "ram_type": "DDR4",
  "profile_support": [],
  "form_factor": "288-pin DIMM",
  "modules": {
    "quantity": 2,
    "capacity_gb": 32
  },
  "capacity": 64,
  "color": ["GREY"],
  "lighting": [],
  "cas_latency": 16,
  "timings": "16-18-18-38",
  "voltage": null,
  "ecc": "Non-ECC",
  "registered": "Unbuffered",
  "heat_spreader": true,
  "rgb": false,
  "metadata": {
    "name": "TEAMGROUP T-Force Vulcan Z Gray DDR4-3200 CL16 64GB (2x32GB)",
    "manufacturer": "TEAMGROUP",
    "part_numbers": ["TLZGD464G3200HC16CDC01"],
    "series": "T-Force",
    "variant": "3200 CL16"
  },
  "general_product_information": {},
  "identifiers": {
    "version": 1,
    "identifiers": [
      {
        "type": "ean",
        "value": "0765441650688",
        "region": "all"
      },
      {
        "type": "mpn",
        "value": "TLZGD464G3200HC16CDC",
        "region": "all"
      },
      {
        "type": "mpn",
        "value": "TLZGD464G3200HC16CDC01",
        "region": "all"
      },
      {
        "type": "upc",
        "value": "765441650688",
        "region": "all"
      }
    ],
    "retailer_listings": [
      {
        "source": "amazon",
        "channel": "au",
        "source_product_id": "B08RRR5XP7",
        "pricing_enabled": true,
        "verified": true
      },
      {
        "source": "amazon",
        "channel": "be",
        "source_product_id": "B08RRR5XP7",
        "pricing_enabled": true,
        "verified": true
      },
      {
        "source": "amazon",
        "channel": "ca",
        "source_product_id": "B08RRR5XP7",
        "pricing_enabled": true,
        "verified": true
      },
      {
        "source": "amazon",
        "channel": "de",
        "source_product_id": "B08RRR5XP7",
        "pricing_enabled": true,
        "verified": true
      },
      {
        "source": "amazon",
        "channel": "es",
        "source_product_id": "B08RRR5XP7",
        "pricing_enabled": true,
        "verified": true
      },
      {
        "source": "amazon",
        "channel": "fr",
        "source_product_id": "B08RRR5XP7",
        "pricing_enabled": true,
        "verified": true
      },
      {
        "source": "amazon",
        "channel": "ie",
        "source_product_id": "B08RRR5XP7",
        "pricing_enabled": true,
        "verified": true
      },
      {
        "source": "amazon",
        "channel": "it",
        "source_product_id": "B08RRR5XP7",
        "pricing_enabled": true,
        "verified": true
      },
      {
        "source": "amazon",
        "channel": "jp",
        "source_product_id": "B08RRR5XP7",
        "pricing_enabled": true,
        "verified": true
      },
      {
        "source": "amazon",
        "channel": "nl",
        "source_product_id": "B08RRR5XP7",
        "pricing_enabled": true,
        "verified": true
      },
      {
        "source": "amazon",
        "channel": "pl",
        "source_product_id": "B08RRR5XP7",
        "pricing_enabled": true,
        "verified": true
      },
      {
        "source": "amazon",
        "channel": "se",
        "source_product_id": "B08RRR5XP7",
        "pricing_enabled": true,
        "verified": true
      },
      {
        "source": "amazon",
        "channel": "sg",
        "source_product_id": "B08RRR5XP7",
        "pricing_enabled": true,
        "verified": true
      },
      {
        "source": "amazon",
        "channel": "uk",
        "source_product_id": "B08RRR5XP7",
        "pricing_enabled": true,
        "verified": true
      },
      {
        "source": "amazon",
        "channel": "us",
        "source_product_id": "B08RRR5XP7",
        "pricing_enabled": true,
        "verified": true
      },
      {
        "source": "back-to-the-office",
        "channel": "uk",
        "source_product_id": "55308751405438",
        "pricing_enabled": true,
        "verified": false
      },
      {
        "source": "cenowarka",
        "channel": "pl",
        "source_product_id": "2325085",
        "pricing_enabled": true,
        "verified": false
      },
      {
        "source": "geizhals",
        "channel": "de",
        "source_product_id": "2325085",
        "pricing_enabled": true,
        "verified": false
      },
      {
        "source": "newegg",
        "channel": "ca",
        "source_product_id": "N82E16820331496",
        "pricing_enabled": true,
        "verified": false
      },
      {
        "source": "newegg",
        "channel": "us",
        "source_product_id": "N82E16820331496",
        "pricing_enabled": true,
        "verified": false
      },
      {
        "source": "quzo",
        "channel": "uk",
        "source_product_id": "390792",
        "pricing_enabled": true,
        "verified": false
      },
      {
        "source": "skinflint",
        "channel": "uk",
        "source_product_id": "2325085",
        "pricing_enabled": true,
        "verified": false
      },
      {
        "source": "walmart",
        "channel": "us",
        "source_product_id": "488119284",
        "pricing_enabled": true,
        "verified": false
      }
    ]
  }
}
