{
  "opendb_id": "eb2fa1f1-f8f9-4d6f-956d-cac43baba90e",
  "speed": 2800,
  "ram_type": "DDR4",
  "profile_support": [],
  "form_factor": "288-pin DIMM",
  "modules": {
    "quantity": 2,
    "capacity_gb": 16
  },
  "capacity": 32,
  "color": ["PINK", "GREY"],
  "lighting": [],
  "cas_latency": 14,
  "voltage": null,
  "ecc": "Non-ECC",
  "registered": "Unbuffered",
  "heat_spreader": true,
  "rgb": false,
  "metadata": {
    "name": "G.Skill Trident Z Pink / Silver DDR4-2800 CL14 32GB (2x16GB)",
    "manufacturer": "G.SKILL",
    "part_numbers": ["F4-2800C14D-32GTZ"],
    "series": "Trident",
    "variant": "2800 CL14"
  },
  "general_product_information": {},
  "identifiers": {
    "version": 1,
    "identifiers": [
      {
        "type": "mpn",
        "value": "F4-2800C14D-32GTZ",
        "region": "all"
      }
    ],
    "retailer_listings": []
  }
}
