{
  "opendb_id": "70c0f108-0118-4d3f-bfdb-852e00b731b4",
  "speed": 6400,
  "ram_type": "DDR5",
  "profile_support": [],
  "form_factor": "288-pin DIMM",
  "modules": {
    "quantity": 2,
    "capacity_gb": 32
  },
  "capacity": 64,
  "color": ["GREY", "BLACK"],
  "lighting": ["None"],
  "cas_latency": 32,
  "voltage": null,
  "ecc": "Non-ECC",
  "registered": "Unbuffered",
  "heat_spreader": true,
  "rgb": false,
  "metadata": {
    "name": "Kingston FURY Renegade Silver / Black DDR5-6400 CL32 64GB (2x32GB)",
    "manufacturer": "Kingston",
    "part_numbers": ["KF564C32RSK2-64"],
    "series": "FURY Renegade",
    "variant": "6400 CL32",
    "manufacturer_color": "Black / Silver"
  },
  "general_product_information": {},
  "identifiers": {
    "version": 1,
    "identifiers": [
      {
        "type": "ean",
        "value": "0740617339406",
        "region": "all"
      },
      {
        "type": "mpn",
        "value": "KF564C32RSK2-64",
        "region": "all"
      },
      {
        "type": "upc",
        "value": "740617339406",
        "region": "all"
      }
    ],
    "retailer_listings": [
      {
        "source": "alternate",
        "channel": "de",
        "source_product_id": "100023612",
        "pricing_enabled": true,
        "verified": false
      },
      {
        "source": "alternate",
        "channel": "es",
        "source_product_id": "100023612",
        "pricing_enabled": true,
        "verified": false
      },
      {
        "source": "alternate",
        "channel": "fr",
        "source_product_id": "100023612",
        "pricing_enabled": true,
        "verified": false
      },
      {
        "source": "alternate",
        "channel": "it",
        "source_product_id": "100023612",
        "pricing_enabled": true,
        "verified": false
      },
      {
        "source": "amazon",
        "channel": "au",
        "source_product_id": "B0CKZ7WRKD",
        "pricing_enabled": true,
        "verified": true
      },
      {
        "source": "amazon",
        "channel": "be",
        "source_product_id": "B0CKZ7WRKD",
        "pricing_enabled": true,
        "verified": true
      },
      {
        "source": "amazon",
        "channel": "ca",
        "source_product_id": "B0CKZ7WRKD",
        "pricing_enabled": true,
        "verified": true
      },
      {
        "source": "amazon",
        "channel": "de",
        "source_product_id": "B0CKZ7WRKD",
        "pricing_enabled": true,
        "verified": true
      },
      {
        "source": "amazon",
        "channel": "es",
        "source_product_id": "B0CKZ7WRKD",
        "pricing_enabled": true,
        "verified": true
      },
      {
        "source": "amazon",
        "channel": "fr",
        "source_product_id": "B0CKZ7WRKD",
        "pricing_enabled": true,
        "verified": true
      },
      {
        "source": "amazon",
        "channel": "ie",
        "source_product_id": "B0CKZ7WRKD",
        "pricing_enabled": true,
        "verified": true
      },
      {
        "source": "amazon",
        "channel": "it",
        "source_product_id": "B0CKZ7WRKD",
        "pricing_enabled": true,
        "verified": true
      },
      {
        "source": "amazon",
        "channel": "jp",
        "source_product_id": "B0CKZ7WRKD",
        "pricing_enabled": true,
        "verified": true
      },
      {
        "source": "amazon",
        "channel": "nl",
        "source_product_id": "B0CKZ7WRKD",
        "pricing_enabled": true,
        "verified": true
      },
      {
        "source": "amazon",
        "channel": "pl",
        "source_product_id": "B0CKZ7WRKD",
        "pricing_enabled": true,
        "verified": true
      },
      {
        "source": "amazon",
        "channel": "se",
        "source_product_id": "B0CKZ7WRKD",
        "pricing_enabled": true,
        "verified": true
      },
      {
        "source": "amazon",
        "channel": "sg",
        "source_product_id": "B0CKZ7WRKD",
        "pricing_enabled": true,
        "verified": true
      },
      {
        "source": "amazon",
        "channel": "uk",
        "source_product_id": "B0CKZ7WRKD",
        "pricing_enabled": true,
        "verified": true
      },
      {
        "source": "amazon",
        "channel": "us",
        "source_product_id": "B0CKZ7WRKD",
        "pricing_enabled": true,
        "verified": true
      },
      {
        "source": "back-to-the-office",
        "channel": "uk",
        "source_product_id": "55306322968958",
        "pricing_enabled": true,
        "verified": false
      },
      {
        "source": "cenowarka",
        "channel": "pl",
        "source_product_id": "3043913",
        "pricing_enabled": true,
        "verified": false
      },
      {
        "source": "geizhals",
        "channel": "de",
        "source_product_id": "3043913",
        "pricing_enabled": true,
        "verified": false
      },
      {
        "source": "jimms-pc",
        "channel": "fi",
        "source_product_id": "196767",
        "pricing_enabled": true,
        "verified": false
      },
      {
        "source": "overclockers",
        "channel": "uk",
        "source_product_id": "MEM-KNG-03179",
        "pricing_enabled": true,
        "verified": false
      },
      {
        "source": "proshop",
        "channel": "de",
        "source_product_id": "3218141",
        "pricing_enabled": true,
        "verified": false
      },
      {
        "source": "proshop",
        "channel": "fi",
        "source_product_id": "3218141",
        "pricing_enabled": true,
        "verified": false
      },
      {
        "source": "proshop",
        "channel": "nl",
        "source_product_id": "3218141",
        "pricing_enabled": true,
        "verified": false
      },
      {
        "source": "proshop",
        "channel": "pl",
        "source_product_id": "3218141",
        "pricing_enabled": true,
        "verified": false
      },
      {
        "source": "quzo",
        "channel": "uk",
        "source_product_id": "351098",
        "pricing_enabled": true,
        "verified": false
      },
      {
        "source": "ruedecommerce",
        "channel": "fr",
        "source_product_id": "AR202502030215",
        "pricing_enabled": true,
        "verified": false
      },
      {
        "source": "skinflint",
        "channel": "uk",
        "source_product_id": "3043913",
        "pricing_enabled": true,
        "verified": false
      }
    ]
  }
}
