{
  "opendb_id": "979ae02f-81f5-4fed-997f-a21ab0d017b9",
  "speed": 3600,
  "ram_type": "DDR4",
  "profile_support": [],
  "form_factor": "288-pin DIMM",
  "modules": {
    "quantity": 1,
    "capacity_gb": 8
  },
  "capacity": 8,
  "color": ["WHITE"],
  "lighting": [],
  "cas_latency": 18,
  "timings": "18-22-22-42",
  "voltage": null,
  "ecc": "Non-ECC",
  "registered": "Unbuffered",
  "heat_spreader": true,
  "rgb": false,
  "metadata": {
    "name": "Lexar THOR White DDR4-3600 CL18 8GB (1x8GB)",
    "manufacturer": "Lexar",
    "part_numbers": ["LD4BU008G-R3600GSWG"],
    "series": "THOR",
    "variant": "3600 CL18"
  },
  "general_product_information": {},
  "identifiers": {
    "version": 1,
    "identifiers": [
      {
        "type": "mpn",
        "value": "LD4BU008G-R3600GSWG",
        "region": "all"
      }
    ],
    "retailer_listings": []
  }
}
