{
  "opendb_id": "af918885-84ce-4e3e-aac3-926e8bfcbf16",
  "speed": 6400,
  "ram_type": "DDR5",
  "profile_support": [],
  "form_factor": "288-pin DIMM",
  "modules": {
    "quantity": 2,
    "capacity_gb": 32
  },
  "capacity": 64,
  "color": [],
  "lighting": [],
  "cas_latency": 52,
  "timings": "52-52-52-103",
  "voltage": 1.1,
  "ecc": "Non-ECC",
  "registered": "Unbuffered",
  "metadata": {
    "name": "GeIL GEMINI RGB DDR5-6400 64GB (2x32GB) CL52 Space Grey",
    "manufacturer": "GeIL",
    "part_numbers": ["GMSG564GB6400C52DC"],
    "series": "GEMINI RGB DDR5",
    "manufacturer_color": "Space Grey"
  },
  "general_product_information": {},
  "identifiers": {
    "version": 1,
    "identifiers": [
      {
        "type": "mpn",
        "value": "GMSG564GB6400C52DC",
        "region": "all"
      }
    ],
    "retailer_listings": []
  }
}
