{
  "opendb_id": "a401fc6f-231a-4214-ad18-9d9948a1199e",
  "speed": 1866,
  "ram_type": "DDR3",
  "profile_support": [],
  "form_factor": "240-pin DIMM",
  "modules": {
    "quantity": 2,
    "capacity_gb": 4
  },
  "capacity": 8,
  "color": ["RED", "GREY"],
  "lighting": [],
  "cas_latency": 10,
  "voltage": null,
  "ecc": "Non-ECC",
  "registered": "Unbuffered",
  "heat_spreader": true,
  "rgb": false,
  "metadata": {
    "name": "Kingston HyperX Fury Red / Silver DDR3-1866 CL10 8GB (2x4GB)",
    "manufacturer": "Kingston",
    "part_numbers": ["HX318C10FRK2", "8"],
    "series": "HyperX",
    "variant": "1866 CL10"
  },
  "general_product_information": {},
  "identifiers": {
    "version": 1,
    "identifiers": [
      {
        "type": "mpn",
        "value": "8",
        "region": "all"
      },
      {
        "type": "mpn",
        "value": "HX318C10FRK2",
        "region": "all"
      }
    ],
    "retailer_listings": []
  }
}
