{
  "opendb_id": "bc2dff59-6a01-4b8f-a9aa-312fad5a53c9",
  "speed": 5600,
  "ram_type": "DDR5",
  "profile_support": ["EXPO"],
  "form_factor": "288-pin DIMM",
  "modules": {
    "quantity": 1,
    "capacity_gb": 64
  },
  "capacity": 64,
  "color": ["BLACK"],
  "lighting": [],
  "cas_latency": 46,
  "timings": "46-45-45",
  "voltage": 1.1,
  "ecc": "Non-ECC",
  "registered": "Unbuffered",
  "metadata": {
    "name": "Kingston ValueRAM DDR5-5600 64GB (1x64GB) CL46",
    "manufacturer": "Kingston",
    "part_numbers": [],
    "series": "ValueRAM"
  },
  "general_product_information": {},
  "identifiers": {
    "version": 1,
    "identifiers": [
      {
        "type": "mpn",
        "value": "KVR56U46BD8-64",
        "region": "all"
      }
    ],
    "retailer_listings": []
  }
}
