{
  "opendb_id": "4ac9d0aa-f044-4334-99c5-a4210dd1cab3",
  "speed": 2400,
  "ram_type": "DDR4",
  "profile_support": [],
  "form_factor": "288-pin DIMM",
  "modules": {
    "quantity": 2,
    "capacity_gb": 8
  },
  "capacity": 16,
  "color": ["RED", "BLACK"],
  "lighting": [],
  "cas_latency": 16,
  "voltage": null,
  "ecc": "Non-ECC",
  "registered": "Unbuffered",
  "heat_spreader": true,
  "rgb": false,
  "metadata": {
    "name": "ADATA XPG Z1 Red / Black DDR4-2400 CL16 16GB (2x8GB)",
    "manufacturer": "ADATA",
    "part_numbers": ["AX4U2400W8G16-DRZ"],
    "series": "XPG",
    "variant": "2400 CL16"
  },
  "general_product_information": {},
  "identifiers": {
    "version": 1,
    "identifiers": [
      {
        "type": "mpn",
        "value": "AX4U2400W8G16-DRZ",
        "region": "all"
      }
    ],
    "retailer_listings": []
  }
}
