{
  "opendb_id": "8a943cd3-d4f9-41fc-8d3d-7c21dbd42786",
  "speed": 6000,
  "ram_type": "DDR5",
  "profile_support": [],
  "form_factor": "288-pin DIMM",
  "modules": {
    "quantity": 2,
    "capacity_gb": 32
  },
  "capacity": 64,
  "color": ["BLACK"],
  "lighting": ["ARGB"],
  "cas_latency": 30,
  "timings": "30-40-40-76",
  "voltage": null,
  "ecc": "Non-ECC",
  "registered": "Unbuffered",
  "heat_spreader": true,
  "rgb": true,
  "metadata": {
    "name": "Patriot Venom RGB Black DDR5-6000 CL30 64GB (2x32GB)",
    "manufacturer": "Patriot",
    "part_numbers": ["PVVR564G600C30K"],
    "series": "Viper Venom",
    "variant": "6000 CL30"
  },
  "general_product_information": {},
  "identifiers": {
    "version": 1,
    "identifiers": [
      {
        "type": "ean",
        "value": "4711378428223",
        "region": "all"
      },
      {
        "type": "mpn",
        "value": "PVVR564G600C30K",
        "region": "all"
      },
      {
        "type": "upc",
        "value": "4711378428223",
        "region": "all"
      }
    ],
    "retailer_listings": [
      {
        "source": "alternate",
        "channel": "de",
        "source_product_id": "100063943",
        "pricing_enabled": true,
        "verified": false
      },
      {
        "source": "alternate",
        "channel": "es",
        "source_product_id": "100063943",
        "pricing_enabled": true,
        "verified": false
      },
      {
        "source": "alternate",
        "channel": "fr",
        "source_product_id": "100063943",
        "pricing_enabled": true,
        "verified": false
      },
      {
        "source": "alternate",
        "channel": "it",
        "source_product_id": "100063943",
        "pricing_enabled": true,
        "verified": false
      },
      {
        "source": "amazon",
        "channel": "au",
        "source_product_id": "B0D4NNWN29",
        "pricing_enabled": true,
        "verified": true
      },
      {
        "source": "amazon",
        "channel": "be",
        "source_product_id": "B0D4NNWN29",
        "pricing_enabled": true,
        "verified": true
      },
      {
        "source": "amazon",
        "channel": "ca",
        "source_product_id": "B0D4NNWN29",
        "pricing_enabled": true,
        "verified": true
      },
      {
        "source": "amazon",
        "channel": "de",
        "source_product_id": "B0D4NNWN29",
        "pricing_enabled": true,
        "verified": true
      },
      {
        "source": "amazon",
        "channel": "es",
        "source_product_id": "B0D4NNWN29",
        "pricing_enabled": true,
        "verified": true
      },
      {
        "source": "amazon",
        "channel": "fr",
        "source_product_id": "B0D4NNWN29",
        "pricing_enabled": true,
        "verified": true
      },
      {
        "source": "amazon",
        "channel": "ie",
        "source_product_id": "B0D4NNWN29",
        "pricing_enabled": true,
        "verified": true
      },
      {
        "source": "amazon",
        "channel": "it",
        "source_product_id": "B0D4NNWN29",
        "pricing_enabled": true,
        "verified": true
      },
      {
        "source": "amazon",
        "channel": "jp",
        "source_product_id": "B0D4NNWN29",
        "pricing_enabled": true,
        "verified": true
      },
      {
        "source": "amazon",
        "channel": "nl",
        "source_product_id": "B0D4NNWN29",
        "pricing_enabled": true,
        "verified": true
      },
      {
        "source": "amazon",
        "channel": "pl",
        "source_product_id": "B0D4NNWN29",
        "pricing_enabled": true,
        "verified": true
      },
      {
        "source": "amazon",
        "channel": "se",
        "source_product_id": "B0D4NNWN29",
        "pricing_enabled": true,
        "verified": true
      },
      {
        "source": "amazon",
        "channel": "sg",
        "source_product_id": "B0D4NNWN29",
        "pricing_enabled": true,
        "verified": true
      },
      {
        "source": "amazon",
        "channel": "uk",
        "source_product_id": "B0D4NNWN29",
        "pricing_enabled": true,
        "verified": true
      },
      {
        "source": "amazon",
        "channel": "us",
        "source_product_id": "B0D4NNWN29",
        "pricing_enabled": true,
        "verified": true
      },
      {
        "source": "cenowarka",
        "channel": "pl",
        "source_product_id": "3204192",
        "pricing_enabled": true,
        "verified": false
      },
      {
        "source": "cyberport",
        "channel": "de",
        "source_product_id": "2425-020",
        "pricing_enabled": true,
        "verified": false
      },
      {
        "source": "geizhals",
        "channel": "de",
        "source_product_id": "3204192",
        "pricing_enabled": true,
        "verified": false
      },
      {
        "source": "newegg",
        "channel": "ca",
        "source_product_id": "N82E16820225345",
        "pricing_enabled": true,
        "verified": false
      },
      {
        "source": "newegg",
        "channel": "us",
        "source_product_id": "N82E16820225345",
        "pricing_enabled": true,
        "verified": false
      },
      {
        "source": "overclockers",
        "channel": "uk",
        "source_product_id": "MEM-PAT-06971",
        "pricing_enabled": true,
        "verified": false
      },
      {
        "source": "paradigit",
        "channel": "ie",
        "source_product_id": "80068908",
        "pricing_enabled": true,
        "verified": false
      },
      {
        "source": "paradigit",
        "channel": "nl",
        "source_product_id": "80068908",
        "pricing_enabled": true,
        "verified": false
      },
      {
        "source": "proshop",
        "channel": "de",
        "source_product_id": "3361581",
        "pricing_enabled": true,
        "verified": false
      },
      {
        "source": "proshop",
        "channel": "fi",
        "source_product_id": "3361581",
        "pricing_enabled": true,
        "verified": false
      },
      {
        "source": "proshop",
        "channel": "nl",
        "source_product_id": "3361581",
        "pricing_enabled": true,
        "verified": false
      },
      {
        "source": "proshop",
        "channel": "pl",
        "source_product_id": "3361581",
        "pricing_enabled": true,
        "verified": false
      },
      {
        "source": "skinflint",
        "channel": "uk",
        "source_product_id": "3204192",
        "pricing_enabled": true,
        "verified": false
      },
      {
        "source": "walmart",
        "channel": "us",
        "source_product_id": "12896811975",
        "pricing_enabled": true,
        "verified": false
      }
    ]
  }
}
